ID_FORMATION,TITRE_FORMATION,KEYWORDS,ID_SOUS_DOMAINE
230,L’expérience client au service de la fidélisation ,"Fidélisation client,  expérience client, négociation commerciale, techniques de vente, relation client,  marketing relationnel,  satisfaction client,  CRM,  Salesforce, Hubspot, Zoho CRM,  Pipedrive,  Microsoft Dynamics 365,  SugarCRM",72
231,Réussir sa relation de service interne ,"Relation client, service client, négociation commerciale, techniques de vente, fidélisation client, communication interne, management transversal,  CRM, Salesforce, Hubspot, Zoho CRM, Microsoft Dynamics 365, Pipedrive, Zendesk",72
232,L'essentiel de la négociation commerciale ,"Négociation commerciale, vente BtoB, techniques de vente, argumentaire commercial, prospection commerciale, closing, fidélisation client, Salesforce, Hubspot, Zoho CRM, Pipedrive,  Copper,  Freshsales,  Agile CRM",72
234,Négociation commerciale - niveau 2 : tactiques et comportements ,"Négociation, vente, prospection, relation client, closing, argumentaire, stratégie commerciale, techniques de vente,  comportement client, psychologie commerciale,  CRM,  Salesforce, Hubspot, Pipedrive",72
238,Répondre à un appel d'offre ,"Négociation commerciale,  techniques de vente,  rédaction offre,  appel d'offres,  prospection,  clients,  management,  CRM,  Salesforce,  HubSpot,  Zoho CRM,  Pipedrive,  Microsoft Dynamics 365,  Oracle Siebel",72
241,Réussir ses entretiens de vente à distance ,"prospection téléphonique, argumentaire vente, techniques de vente, négociation commerciale, relation client, fidélisation client, closing,  Zoom, Skype, Microsoft Teams, Google Meet, WebEx,GoToMeeting,  Salesforce",72
244,S'affirmer face aux clients difficiles - Niveau 1 ,"Négociation commerciale, techniques de vente, relation client, gestion des objections, communication assertive, argumentation commerciale, fidélisation client,  CRM, Salesforce, Hubspot, Zoho CRM, Pipedrive,  Microsoft Dynamics 365,  SugarCRM",72
247,"Commerciaux, développez votre leadership ","Vente, négociation, leadership, management, prospection, relation client, performance  Salesforce, HubSpot, Zoho CRM, Pipedrive,  LinkedIn Sales Navigator,  SAP, Microsoft Dynamics 365",72
251,Réussir une vente complexe ,"Négociation commerciale, techniques de vente, cycle de vente, closing, objections clients, fidélisation clients, prospection commerciale, CRM, Salesforce, Hubspot, Zoho CRM, Pipedrive, Microsoft Dynamics 365,  SugarCRM",72
253,Piloter et animer un réseau de distribution ," Management,  Négociation commerciale,  Stratégie commerciale,  Gestion de réseau,  Performance commerciale,  Animation d'équipe,  Fidélisation client,  CRM,  Force de vente,  Gestion de projet,  Analyse de marché,  Techniques de vente,  Salesforce,  HubSpot)",72
257,Le coaching efficace des commerciaux ,"Management commercial, coaching commercial, techniques de vente, développement commercial, performance commerciale, fidélisation client, stratégie commerciale,  Salesforce, HubSpot, Zoho CRM, Microsoft Dynamics 365, Pipedrive,  SugarCRM,  Agile CRM",133
262,Smarketing ," marketing digital, stratégie commerciale,  gestion de clientèle,  techniques de vente,  lead nurturing,  analyse des ventes,  développement commercial,  HubSpot, Salesforce,  Zoho CRM,  Pipedrive,  Microsoft Dynamics 365,  SugarCRM,  Oracle Siebel)",133
263,Culture digitale ," ventes, marketing digital, prospection, négociation, fidélisation, relation client, management d'équipe,  CRM, LinkedIn,  HubSpot, Salesforce,  Salesforce,  Google Ads,  Facebook Ads)",133
270,Responsable community management et marketing de contenus ,"Community management, marketing digital, stratégie de contenu, réseaux sociaux, communication digitale, relations publiques, branding,  Facebook, Instagram, Twitter, LinkedIn, TikTok, YouTube,  Snapchat",100
274,Les fondamentaux de la RSE (Responsabilité Sociétale des Entreprises) ,"Communication interne, communication externe, RSE, responsabilité sociale, développement durable, engagement citoyen, communication responsable,  influence, relations publiques,  médias sociaux,  réputation,  réseaux sociaux,  LinkedIn, Twitter",100
276,"Partenariats de mécénat, fondations, collecte de fonds privés ","Mécénat, fondation, collecte fonds, partenariat, communication interne, communication externe,  sponsoring,  relations publiques, stratégie communication,  marketing, fundraising, philanthropie,  don,  CRM.  Altru,  Benevity, Blackbaud, DonorPerfect, Salesforce",100
280,Communication de crise ,"Communication stratégique, relations publiques, gestion de crise, communication digitale, storytelling,  publicité,  influence,  Twitter, Facebook, LinkedIn, Instagram,  Hootsuite, Mailchimp,  ",100
285,Gérer les échanges avec un public hostile ,"Communication interne, communication externe, gestion de crise, relations publiques,  public hostile,  techniques de communication,  médiation.  Email,  téléphone, réseaux sociaux,  plateformes collaboratives, visioconférence,  logiciels de messagerie.",100
286,3h chrono pour communiquer dans l'urgence en cellule de crise ,"Communication de crise, gestion de crise, communication d'urgence, relations publiques, communication interne, communication externe, plan de communication.  Twitter, Facebook, Slack, WhatsApp, Email, SMS,  Presse",100
292,Réseaux sociaux niveau 2 - Stratégie de communication sur les médias sociaux ,"Communication digitale, stratégie web, community management,  influence marketing, relation client,  branding, e-réputation, Facebook, Instagram, Twitter, LinkedIn, TikTok, YouTube, Snapchat",100
295,"Publicité sur le Web et les réseaux sociaux : SEA, Display, Social ads, Retargeting ","Communication digitale, stratégie web, marketing digital, publicité en ligne, community management, gestion de crise, relations presse, Google Ads, Facebook Ads, LinkedIn Ads, Twitter Ads, Instagram Ads, TikTok Ads,  Snapchat Ads",100
299,Créer des contenus visuels pour le web et les réseaux sociaux ,"Communication digitale,  marketing digital,  réseaux sociaux,  contenu web,  infographie,  community management,  publicité en ligne, Photoshop, Illustrator,  InDesign, Canva,  Premiere Pro, After Effects,  Filmora",100
303,Réussir ses campagnes emailing ,"Emailing, campagne marketing, communication digitale, stratégie digitale, relation client,  publicité online,  marketing automation,  Mailchimp, Sendinblue, ActiveCampaign, HubSpot, Mailjet, ConvertKit,  GetResponse",100
306,Réussir ses événements ,"événements professionnels, communication digitale, relations publiques, gestion de projet,  planification évènementielle, stratégie de communication,  public cible,  Facebook, Twitter, LinkedIn, Instagram,  Mailchimp, Eventbrite, Hootsuite",100
312,Optimiser le référencement naturel (SEO) ,"SEO, référencement, communication digitale,  marketing digital, stratégie web,  contenu web,  audit SEO,  Google Search Console,  Google Analytics,  SEMrush,  Ahrefs,  Majestic SEO,  Moz,  HubSpot",100
316,S'entraîner à la prise de parole en public ,"prise de parole,  communication orale,  public speaking,  éloquence,  techniques oratoires,  confiance en soi,  gestion du stress,  méthodologie,  exercices pratiques,  atelier,  formation,  coaching,  vidéo,  webinaire,  Zoom,  Teams,  Skype,  Gotowebinar",101
320,Aller à l'essentiel à l'écrit et à l'oral ,"Communication efficace, prise de parole, expression écrite,  concision, clarté,  écoute active,  feedback,  techniques oratoires,  langage corporel,  écriture professionnelle,  Microsoft Teams, Zoom,  Slack,  Google Meet,  Skype",101
323,3h chrono pour valoriser son image en distanciel ,"Communication non verbale, prise de parole, élocution, confiance en soi,  techniques de communication,  impact,  influence,  Zoom, Microsoft Teams, Skype, Google Meet, WebEx,  GoToMeeting",101
325,Renforcer l'impact de ses prises de parole en public ,"prise de parole,  communication orale,  public speaking,  éloquence,  assurance,  confiance en soi,  impact,  techniques oratoires,  gestuelle,  méthodologie,  coaching,  formation,  ateliers,  séminaire.  Skype, Zoom, Google Meet,  Teams,  Discord,  Gather.town",101
327,Réussir ses présentations orales avec des supports visuels percutants ,"Présentation orale, prise de parole, communication verbale,  techniques oratoires,  langage corporel,  support visuel,  techniques de persuasion, PowerPoint,  Google Slides,  Prezi,  Canva,  Keynote,  Zoom,  Microsoft Teams",101
328,Prise de parole : captiver son auditoire ,"Orateur, éloquence, rhétorique, présentation, storytelling, confiance en soi, public,  techniques vocales,  langage corporel,  Microsoft Teams, Zoom, Google Meet,  Skype, Webex",101
332,Être à l'aise à l'écrit : gagner en fluidité ,"Rédaction professionnelle,  orthographe, grammaire,  style rédactionnel,  clarité, concision,  efficacité communication écrite,  Microsoft Word, Google Docs,  LibreOffice Writer,  Grammarly,  Hemingway Editor,  ProWritingAid",102
336,Rédiger des e-mails plus efficaces et impactants ,"Ecrire, rédaction, email, communication écrite, impact, efficacité, message, audience,  publicité, marketing,  Microsoft Outlook, Gmail,  Mailchimp,  Thunderbird",102
341,Lire vite et retenir l'essentiel ,"lecture rapide, synthèse d'informations, communication écrite, rédaction professionnelle, orthographe, grammaire, vocabulaire,  techniques de mémorisation,  Evernote, OneNote, Google Docs,  Scrivener,  Notion,  Trello,  MindManager",102
344,Les fondamentaux de la prise de notes ,"Rédaction professionnelle,  prise de notes efficace,  communication écrite,  méthodologie rédactionnelle,  techniques de synthèse,  organisation documentaire,  apprentissage rapide,  Microsoft OneNote,  Evernote,  Google Keep,  Notion,  Bear,  Simplenote,  OneNote",102
345,Se réconcilier avec l'orthographe - Niveau 1 : les fondamentaux en langue française ,"Grammaire, orthographe, conjugaison, vocabulaire, rédaction, style, expression écrite,  Word, Google Docs, LibreOffice Writer,  Grammarly,  Antidote,  Hemingway Editor",102
349,Réseaux sociaux niveau 3 - Optimiser la performance de sa stratégie social media ,"Stratégie digitale, community management,  influence marketing,  publicité en ligne,  analyse web,  engagement,  relation client,  Twitter, Facebook, Instagram, LinkedIn, TikTok,  YouTube, Pinterest",100
350,Déployer un programme d'Employee Advocacy ,"Communication interne, communication externe, Employee Advocacy, programme d'influence,  réputation digitale, engagement collaborateurs,  influence marketing,  LinkedIn, Twitter, Facebook, Instagram, Yammer,  Microsoft Teams, SharePoint",100
352,Optimiser ses écrits professionnels grâce à l’IA ,"Rédaction professionnelle,  orthographe, grammaire, style,  concision,  efficacité,  clarité, ChatGPT, Jasper, Copy.ai,  Grammarly, QuillBot, ProWritingAid",102
355,Pratique de la comptabilité générale - Niveau 1 ,"Comptabilité générale, normes IFRS, bilan, compte de résultat, trésorerie, TVA, amortissement,  Sage, QuickBooks, Cegid, Xero, EBP, Excel",205
358,Monter le bilan et la liasse fiscale ,"Bilan comptable, liasse fiscale, déclaration fiscale, impôts, TVA, comptabilité générale, normes comptables,  logiciel comptable, Excel, Sage, QuickBooks, Cegid, EBP, Xero",205
361,Comptabilité analytique : décider sur la base de coûts pertinents ,"Comptabilité de gestion, coûts de production, rentabilité, analyse financière,  reporting,  budgeting,  gestion prévisionnelle,  SAP, Sage,  Xero, QuickBooks, Excel,  Power BI",205
364,Contrôler les factures fournisseurs ,"Comptabilité fournisseurs, contrôle de gestion, facturation, rapprochement bancaire, TVA,  audit interne,  gestion des impayés,  Sage, QuickBooks, Xero, Cegid, EBP, SAP,  Excel",205
367,Maîtriser la comptabilité clients ,"Comptabilité clients, facturation, recouvrement, trésorerie, impayés, bilan, reporting, QuickBooks, Xero, Sage, Cegid, EBP, SAP, Excel",205
369,Paie et charges sociales - Niveau 1 ,"Comptabilité générale, fiscalité des entreprises, paie, charges sociales, droit du travail, gestion budgétaire, déclarations fiscales, logiciels comptables,  Sage, Cegid, QuickBooks,  AAT, Xero,  Excel",205
372,Évaluer et constater les impôts différés ,"Impôts différés, évaluation, constatation, fiscalité, comptabilité, normes IFRS, bilan.  Tax,  SAP, Oracle, Sage, QuickBooks, Xero, Cegid.",205
3,Formation au métier d'acheteur ,"Négociation,  approvisionnement,  sourcing,  contrat,  logistique,  performance,  supply chain,  SAP Ariba,  Coupa,  Oracle Procurement Cloud,  Zycus,  Ivalua,  Jaggaer,  Basware",206
7,Achats pour non-acheteurs ,"négociation fournisseurs, stratégie achats,  analyse des coûts,  gestion des stocks,  commande publique,  performance achats,  supply chain.  SAP Ariba, Coupa, Jaggaer, Ivalua, Oracle Procurement Cloud, Zycus,  Basware",206
12,Cartographier et prioriser ses achats avec le marketing achats ,"Marketing achats,  Négociation achats,  Gestion des achats,  Stratégie achats,  Analyse des achats,  Priorisation achats,  Cartographie achats,  Excel,  SAP Ariba,  Coupa,  Oracle Procurement Cloud,  Zycus,  Jaggaer,  Ivalua",3
13,Améliorer la performance des achats grâce au digital ,"Négociation,  supply chain,  gestion des fournisseurs,  optimisation des coûts,  e-procurement,  analyse des données,  performance achats,  SAP Ariba, Coupa,  Oracle Procurement,  Jaggaer,  Zycus,  Ivalua,  Basware",3
14,Achats et conduite de projet : une synergie efficace ,"Négociation,  sourcing,  approvisionnement,  gestion des stocks,  analyse des coûts,  planification,  performance,  SAP Ariba,  Coupa,  Oracle Procurement Cloud,  Ivalua,  Zycus,  Jaggaer,  SciQuest",3
17,Innover avec l'analyse de la valeur ,"Négociation,  Analyse,  Supply Chain,  Gestion des coûts,  Performance Achats,  Innovation,  Valeur,  SAP Ariba,  Coupa,  Oracle Procurement Cloud,  Jaggaer,  Zycus,  Ivalua,  Basware",3
21,Sourcing et évaluation des fournisseurs ,"Négociation,  Approvisionnement,  Logistique,  Gestion des stocks,  Analyse des coûts,  Performance achats,  Risques achats,  SAP Ariba, Coupa, Oracle Procurement Cloud, Jaggaer, Zycus, Ivalua,  Spend Management",3
25,Les achats de prestations intellectuelles ,"Négociation,  contrats,  fournisseurs,  gestion de projet,  analyse des coûts,  risques,  compliance,  SAP Ariba,  Coupa,  Oracle Procurement Cloud,  Ivalua,  Jaggaer,  Zycus,  Basware",3
27,Développement Durable et achats : pratiquer l'achat responsable ,"Achats responsables,  durabilité,  approvisionnement,  sourcing,  éco-conception,  gestion des achats,  performance achats,  outils achats,  méthodologies achats,  normes environnementales,  labels écologiques,  analyse cycle de vie,  plateformes achats,  logiciels achats.",3
31,Maîtriser la réglementation de l'achat public - Niveau 1 ,"Marchés publics,  dématérialisation,  procédures,  contrats,  spécifications,  performance,  compliance,  e-Achats,  Chorus Pro,  Marché public simplifié,  achat public européen,  outils achats,  référentiel achat,  réglementations",4
33,Construire un Cahier des Clauses Techniques Particulières (CCTP) ,"Marchés publics, réglementation, spécifications techniques,  consultation fournisseurs,  négociation,  rédaction,  appels d'offres,  logiciels marchés publics,  plateformes e-achats,  outil CCTP,  modèle CCTP,  gestion de projet,  gestion des contrats,  Excel.",4
39,Assistant(e) de direction ,"Assistanat,Secrétariat,Management,Organisation,Communication,Agenda,Planning,Outlook,Excel,Word,PowerPoint,Google Agenda,Slack,Teams",5
42,Cycle Assistant(e) ,"emploi, recrutement, formation professionnelle,  stages,  candidature,  CV, lettre de motivation,  Pôle Emploi, APEC,  Apec, Indeed, LinkedIn,  Monster, RégionsJob",5
46,Chargé(e) de formation ,"Formation professionnelle, métiers pédagogiques,  enseignement,  apprentissage,  didactique, ressources humaines,  recrutement,  PowerPoint, Moodle,  Google Classroom,  Skillshare,  LinkedIn Learning,  Coursera,  edX",5
50,L'assistant(e) Ressources Humaines ,"Ressources Humaines, recrutement, gestion du personnel, administration du personnel,  gestion des dossiers,  communication interne,  relations sociales,  Taleo,  Workday,  SuccessFactors,  BambooHR,  SAP SuccessFactors,  Cornerstone OnDemand,  PeopleSoft",5
55,Assistant(e)s du service import export ,"Import-export, douanes, logistique, négociation, commerce international, administration, management,  SAP,  Oracle,  Magento,  Shopify,  Salesforce,  MS Dynamics 365",5
59,Assistant(e) de plusieurs managers ,"Organisation, Gestion du temps, Priorisation, Communication,  Collaboration,  Efficacité,  Productivité,  Outlook,  Google Calendar,  Asana,  Trello,  Notion, Slack, Microsoft Teams",134
62,Marketing de soi : gagner en visibilité ,"Efficacité professionnelle,  assistant manager,  réseautage professionnel,  gestion du temps,  communication,  marketing personnel,  branding personnel, LinkedIn, Viadeo,  Indeed,  Glassdoor,  Twitter,  Instagram,  Facebook",134
65,Gagner du temps et s'organiser avec Outlook ,"Gestion du temps, organisation, productivité, efficacité, Outlook,  planning,  priorisation,  Microsoft To Do, Google Calendar, Any.do,  Asana,  Notion, Trello, OneNote",134
67,3h chrono pour planifier et organiser son télétravail ,"Gestion du temps, organisation, télétravail, productivité, planification, efficacité professionnelle, outils collaboratifs,  Asana, Trello, Monday.com, Microsoft To Do, Google Calendar, Outlook, Notion",134
70,Chef de projet occasionnel ,"Organisation, Gestion du temps, Priorisation, Communication, Collaboration,  Productivité,  Délégation,  Microsoft Outlook, Google Workspace, Asana, Trello, Monday.com, Slack, Notion",134
72,Microsoft 365® - Exploiter les outils collaboratifs en ligne ,"Productivité, organisation, collaboration, gestion du temps, communication,  outils collaboratifs,  efficacité professionnelle,  Google Workspace,  Slack, Microsoft Teams,  Zoom,  Asana,  Trello,  Notion",134
75,"Spécial Assistant(e)s : Maîtriser Word, Excel et PowerPoint ","Gestion du temps, organisation, communication,  productivité,  collaboration,  archivage,  gestion de projet,  Word, Excel, PowerPoint, Google Docs, Google Sheets, Google Slides,  OneNote,  Outlook",134
78,Spécial Assistant(e)s : Prise de notes et rédaction de comptes rendus efficaces ,"Prise de notes, compte-rendu, rédaction, efficacité, communication, secrétariat, organisation,  Google Docs, Microsoft Word, OneNote, Evernote, Otter.ai,  Zoom,  Teams",6
79,Maîtrisez l'Art de l'Email Professionnel : Communication Assistante,"Email professionnel, communication écrite, rédaction professionnelle, gestion du temps, organisation, efficacité,  négociation,  Outlook, Gmail,  Yahoo Mail,  Thunderbird,  Apple Mail,  Microsoft Exchange,  Zoho Mail",6
80,Maîtrisez l'Art de la Synthèse Écrite :  Communication Optimale pour Assistants,"Rédaction professionnelle, synthèse informative, communication écrite,  notes de synthèse, compte-rendu,  gestion du temps, organisation,  Microsoft Word, Google Docs,  Evernote, OneNote,  Trello, Slack,  Asana",6
83,Spécial Assistant(e)s : Mieux communiquer par téléphone ou en visio ,"Communication téléphonique, visioconférence, relation client,  techniques de communication,  écoute active,  gestion des appels,  assertivité,  Microsoft Teams, Zoom, Google Meet, Skype, Slack,  GoToMeeting,  RingCentral.",6
85,S’affirmer dans ses relations professionnelles - Assertivité les bases ,"Communication assertive, confiance en soi, gestion des conflits, relations professionnelles, affirmation de soi,  développement personnel,  techniques de communication,  gestion du stress,  techniques d'assertivité,  coaching,  mentoring,  formation assertive,  techniques de négociation,  PNL",73
91,"Hôte et hôtesse-standardiste, un métier de communication ","accueil téléphonique, communication verbale, relation client, gestion administrative, organisation du travail, prise d'appel, standard téléphonique,  téléphonie, visioconférence, messagerie instantanée,  logiciels de standard, logiciels de gestion,  CRM,  plateformes collaboratives",5
95,Les fondamentaux de la gestion de patrimoine ,"Gestion patrimoniale, placements financiers, fiscalité patrimoniale, succession, assurance vie, épargne, investissement, outils financiers, stratégies patrimoniales,  analyse financière,  Bourse, immobilier,  Wealth Management,  Private Banking",135
100,L'essentiel de Bâle ,"Risque bancaire, Bâle III, conformité, réglementation, audit interne, supervision bancaire, gestion de crise,  Analyse financière,  Modélisation financière,  Stress test,  Credit Risk+,  SAS,  Bloomberg Terminal,  Reuters",38
105,Entreprises en difficulté et droit des faillites ,"Recouvrement amiable, procédure amiable, action en justice, médiation, renégociation, prévention, insolvabilité,  droit bancaire,  droit commercial,  procédure collective,  liquidation judiciaire, redressement judiciaire,  Fiabilité,  Experian,  Equifax,  Creditreform,  Altares,  Coface,  Graydon.",7
106,Traiter les situations de surendettement des particuliers ,"Surendettement, recouvrement amiable, contentieux bancaire, procédures collectives, négociation, médiation, règlement amiable,  loi Schmit,  FICP,  Banque de France,  Incasso,  Bural,  Credit Manager,  Experian",7
110,Analyse financière des comptes consolidés et normes IFRS ,"Analyse financière, comptes consolidés, normes IFRS, reporting financier, ratios financiers, due diligence, audit financier, SAP, Oracle, Bloomberg Terminal, Refinitiv Eikon, FactSet,  Morningstar,  Capital IQ",158
117,La finance verte et durable ,"Investissement responsable, ESG, critères environnementaux, sociaux, gouvernance, finance durable, impact investing, reporting extra-financier, normes GRI, analyse financière,  gestion de portefeuille,  obligations vertes,  placements durables,  impact social.  ",39
118,Analyse financière des comptes consolidés ,"Analyse financière, comptes consolidés, ratios financiers, normes IFRS, reporting financier,  audit financier,  due diligence,  Banque, Finance d'entreprise,  marché des capitaux,  analyse de crédit,  SAP, Bloomberg Terminal,  FactSet",158
122,"L'essentiel de Word, Excel et PowerPoint ","Word, Excel, PowerPoint,  Logiciels bureautiques,  Productivité,  Formation bureautique,  Traitement de texte,  Tableur,  Présentation,  Outils collaboratifs,  Microsoft 365, Google Workspace, LibreOffice,  Pages",159
125,Excel - Débutant ,"Excel,tableur,calcul,spreadsheet,formules,feuille,graphique,LibreOffice Calc,Google Sheets,Numbers,Microsoft 365,OpenOffice Calc,Zoho Sheet, WPS Office",159
129,3h chrono pour créer des graphiques avec Excel ,"Excel, graphiques, tableaux, données, visualisation, analyse,  formation,  logiciels bureautiques,  PowerPoint, Google Sheets, LibreOffice Calc, Numbers,  SmartSheet,  Data Studio",159
131,"3h chrono pour manipuler du texte, des dates et des heures dans Excel ","Excel,formules,dates,heures,tableaux,automatisation,productivité, Google Sheets, Numbers, LibreOffice Calc, Microsoft Word, OpenOffice Writer, Google Docs,  ",159
134,3h chrono pour exploiter les outils gain de temps d'Excel ,"Excel,  productivité,  efficacité,  tableur,  formules,  automatisation,  tutoriel,  Microsoft 365, Google Sheets,  Numbers, LibreOffice Calc,  formules avancées,  analyse de données,  visualisation de données",159
137,3h chrono pour créer vos premiers tableaux croisés dynamiques ,"Tableaux croisés dynamiques,  Excel,  analyse de données,  visualisation de données,  reporting,  efficacité,  formation,  PowerPoint, Google Sheets, Numbers, LibreOffice Calc,  Data Studio,  Tableau,  SmartSheet",159
141,Excel Macros VBA - Niveau 1 ,"Excel,Macros,VBA,Formules,Fonction,Tableau croisé dynamique,Automatisation,Word,PowerPoint,Access,Google Sheets,LibreOffice Calc,OpenOffice Calc,Apple Numbers",159
144,Word - Débutant ,"Word, Excel, PowerPoint, traitement de texte, tableur, présentation,  logiciels bureautiques,  formation, initiation,  tutoriel, guide,  OpenOffice, LibreOffice, Google Docs",159
147,Word - Consolider ses connaissances pour autodidactes ,"Word, Excel, PowerPoint,  PDF,  Formules,  Macros,  Automatisation,  Google Docs, Google Sheets, LibreOffice,  OpenOffice,  Microsoft 365,  Tutoriel,  Formation",159
151,3h chrono pour concevoir un tutoriel ,"Tutoriel, conception, logiciel, bureautique, PAO, CAO,  3h chrono,  rapide, efficace,  outils, méthode,  Word, Excel, PowerPoint, Publisher",159
153,PowerPoint - Consolider ses connaissances pour autodidactes ,"PowerPoint,  Microsoft Office,  productivité,  formation,  autodidacte,  logiciels,  bureautique,  Word,  Excel,  Google Docs,  Slides,  Canva,  LibreOffice,  Keynote",159
154,Maîtrisez Outlook : Productivité et Organisation Bureautique Optimale,"Outlook,Productivité,Organisation,Gestion du temps,Emailing professionnel,Collaboration,Microsoft 365,Gmail, Thunderbird, Google Agenda,  Evernote,  Notion,  Asana, Slack",159
155,3h chrono pour organiser et partager vos notes dans OneNote ,"OneNote, organisation, partage, notes, productivité, efficacité, gestion du temps,  Microsoft Word,  Microsoft Excel,  Google Docs,  Evernote,  Notion,  Dropbox,  Trello",159
157,Maîtrisez les outils collaboratifs Microsoft Teams en 3h chrono,"Microsoft Teams,  Collaboration,  Productivité,  Outils collaboratifs,  Travail d'équipe,  Gestion de projet,  Communication,  SharePoint,  Skype Entreprise,  Google Workspace, Slack,  Zoom,  Asana, Trello",136
