ID_FORMATION,TITRE_FORMATION,KEYWORDS,ID_SOUS_DOMAINE
2112,Synergie Publique : Excellence en Management Collaboratif,"Management collaboratif, leadership public,  gestion de projet public,  performance publique,  travail d'équipe, communication interservices,  synergie organisationnelle,  outils collaboratifs,  méthodologies agiles,  gestion participative,  intelligence collective,  développement durable,  plateformes collaboratives,  Yammer",94
2116,"CSA/CST/CSE avec attributions en Santé, Sécurité et Conditions de Travail ou Formation Spécialisée SSCT ","Santé Sécurité Travail,  Hygiène,  Ergonomie,  Risques Professionnels,  Prévention,  Sécurité publique,  Conditions de travail,  droit du travail,  réglementation,  formation SST,  CHSCT,  CSSCT,  CE,  DUP",175
2118,Excellence managériale :  éradication du sexisme et du harcèlement au travail (secteur public),"Management, leadership, égalité, diversité, inclusion, harcèlement, sexisme,  formation RH,  coaching,  méthodes collaboratives,  gestion des conflits,  droit du travail,  Ressources Humaines publiques, fonction publique.",175
2125,La laïcité dans le secteur public ,"Neutralité, laïcité, fonction publique, management public, ressources humaines publiques, égalité, diversité,  administration publique,  droit public,  service public,  politique RH,  recrutement public,  formation publique,  RH territoriales",175
2127,Management des compétences dans les organisations publiques ,"Gestion des talents, développement personnel, évaluation des compétences,  planification des effectifs, gestion de carrière, formation professionnelle, mobilité interne,  SIRH,  TalentSoft, SuccessFactors, PeopleSoft, Workday, SAP SuccessFactors,  Chorus.",175
2131,Concevoir et animer des formations captivantes : Le guide du formateur occasionnel du secteur public,"Formation publique,  e-learning,  didactique,  andragogie,  pédagogie,  gestion du temps,  évaluation,  MOOC,  Tutoriel,  PowerPoint,  Prezi,  Google Slides,  Learning Management System  LMS),  Moodle",175
2135,Excellence en animation RH secteur public : Niveau 1,"Management RH,  Motivation équipes publiques,  Gestion des talents,  Développement personnel,  Communication interne,  Recrutement public,  Efficacité collective,  Performance publique,  Solution RH,  Logiciel SIRH,  SuccessFactors,  Workday,  PeopleSoft,  Taleo",175
2137,Maîtrisez l'animation de formations virtuelles en secteur public (Ressources Humaines) :  une formule express en 3 heures,"Formation RH, e-learning,  webinaires,  gestion du temps,  techniques pédagogiques,  plateformes collaboratives,  public secteur,  Zoom,  GoToWebinar,  Microsoft Teams,  Google Meet,  Webex,  Adobe Connect,  Skillshare",175
2144,Maîtrisez le Calcul de la Paie dans le Secteur Public (Niveau 2),"Paie publique, administration publique, gestion RH, logiciel paie, calcul salaire,  droit social, fiches de paie,  Chorus,  E-SIRH,  AgirRH,  Cegid, ADP,  Sage,  Payplug",175
2146,Réinventer sa carrière publique :  S'épanouir face aux mutations,"Fonction publique, mutations professionnelles, évolution carrière, reconversion professionnelle, développement personnel, bilan de compétences, mobilité interne,  réorientation professionnelle,  coaching carrière, outplacement,  réseautage professionnel,  administration publique,  service public, secteur parapublic.",95
2149,Réinventer sa carrière publique : une approche systémique du changement,"Réussite professionnelle, Fonction publique, Mobilité interne, Développement personnel,  Gestion de carrière, Accompagnement professionnel,  Transition professionnelle,  Ressources humaines,  Management public,  Administrations publiques,  Service public,  Coaching professionnel,  Outplacement,  Mind mapping.",95
2153,Transformation Publique :  Naviguer le Changement et Réinventer sa Carrière,"Fonction publique, mobilité professionnelle, transition de carrière, développement professionnel,  gestion du changement,  accompagnement professionnel, outplacement,  République numérique,  SIRH,  e-gouvernement,  transformation digitale,  ateliers collaboratifs,  coaching professionnel,  bilan de compétences",95
2157,Réinventer sa carrière publique :  transition sereine vers la retraite,"Fonction publique, retraite, reconversion professionnelle, transition carrière, développement personnel, bilan de compétences, outplacement,  coaching professionnel,  administration publique,  service public,  gestion de carrière,  planification retraite,  sécurité sociale,  retraite complémentaire.",95
2160,Épanouissement professionnel : Devenir Coach dans le secteur public,"Coaching, accompagnement, développement personnel, fonction publique, management, leadership, épanouissement, réorientation professionnelle, bilan de compétences, entretien professionnel, gestion de carrière, Ressources Humaines, méthodes de coaching, techniques de coaching,  Mentoring, Supervision",95
2163,Collaboration Optimale à Distance : Maîtrise des Outils Numériques pour le Secteur Public,"Collaboration à distance,  productivité,  télétravail,  outils numériques,  gestion de projet,  communication,  efficacité,  Microsoft Teams,  Zoom,  Slack,  Google Workspace,  SharePoint,  Trello,  GoToMeeting",201
2168,Excellence publique : maîtriser la Process Com® pour une performance optimale,"Communication publique, performance collective, management public, leadership, relationnel,  processus décisionnel, collaboration,  Process Com®,  Analyse transactionnelle,  Approche systémique,  Gestion du stress,  Intelligence émotionnelle,  Communication non violente,  Syntra.",201
2174,Relations Professionnelles Optimales : 5 Clés Maîtresses pour le Secteur Public,"Communication interpersonnelle,  collaboration,  gestion du stress,  leadership,  négociation,  assertivité,  efficacité professionnelle,  fonction publique,  service public,  management public,  relations publiques,  travail en équipe,  développement professionnel,  coaching",220
2176,L'excellence professionnelle : Cultiver l'estime de soi dans le secteur public," développement personnel, estime de soi, confiance en soi, leadership, performance, motivation, bien-être, secteur public, fonction publique, service public, management public, coaching, mentoring,  résilience)",220
2183,Épanouissement professionnel secteur public : Maîtriser sereinement son stress,"Gestion du stress, bien-être au travail, sérénité professionnelle, développement personnel, efficacité professionnelle, équilibre vie pro/perso, qualité de vie au travail,  Mindfulness,  Cohérence cardiaque,  Gestion des émotions,  Techniques de relaxation,  Sophrologie,  Yoga,  Résilience",220
2186,Maîtrise émotionnelle :  Performance au service public,"Gestion du stress,  bien-être,  communication,  assertivité,  leadership,  motivation,  résilience,  fonction publique,  service public,  employés publics,  gestion des émotions,  intelligence émotionnelle,  mindfulness,  coaching.",220
2192,Améliorer la relation à l'usager ,"accueil public, relation client, service public, communication, satisfaction usager, gestion réclamations, expérience utilisateur,  téléphone,  email,  CRM,  plateforme collaborative,  logiciel de gestion,  enquête satisfaction,  site web",129
2194,Excellence Relationnelle : Maîtriser l'Accueil des Citoyens,"Accueil citoyen, relation client, communication publique, service public, satisfaction usager, gestion des conflits,  techniques d'accueil,  téléphone,  email,  visioconférence,  logiciels de gestion,  plateformes collaboratives,  CRM,  gestion de la relation client",129
2196,Excellence Relationnelle : Gestion des Appels Clients Délicats (Secteur Public),"Gestion des conflits, communication professionnelle, service client, empathie, techniques d'écoute active, résolution de problèmes, gestion du stress,  téléphonie,  CRM,  Zendesk, Salesforce,  ServiceNow,  Five9, Genesys",129
2201,Excellence des Achats Publics : Devenez un Acheteur Expert,"Marchés publics,  procédures achat,  négociation publique,  règlementations marchés,  performance achats,  optimisation achats,  management achats,  e-procurement,  logiciels achats publics,  dématérialisation,  Achats responsables,  code des marchés publics,  SAP Ariba,  Coupa",178
2205,Maîtriser ses marchés publics de travaux ,"Marchés publics, procédure achat, commande publique, réglementation marchés,  dématérialisation,  consultation,  négociation,  travaux publics,  code des marchés publics,  dépenses publiques,  acheteur public,  e-procurement,  logiciels marchés publics,  Chorus Pro",178
2210,Maîtriser l'art de la communication publique :  relations professionnelles optimisées,"Communication publique, relations presse,  influence publique,  réputation en ligne,  discours public,  communication institutionnelle,  lobbying,  relations médias,  techniques de communication,  stratégie de communication,  public cible,  gestion de crise,  Twitter, Facebook, LinkedIn",96
2215,Excellence rédactionnelle : sublimez votre communication publique,"Rédaction publique, communication institutionnelle,  style rédactionnel,  langue administrative,  clarité rédactionnelle,  impact communication,  public cible.  Word,  Google Docs,  Mailchimp,  Canva,  Hootsuite,  WordPress",96
2216,Maîtrisez l'art de l'email concis : Communication publique en 3h chrono,"Communication publique, rédaction professionnelle, email marketing,  publicité institutionnelle, relations presse,  communication interne,  rédaction administrative,  techniques rédactionnelles,  efficacité communication,  langage clair,  public cible,  réseaux sociaux,  Twitter, Facebook",96
2219,Maîtriser l'art de la synthèse : communication efficace dans le secteur public,"Rédaction administrative, communication institutionnelle, synthèse informative,  mémo, note de service, rapport,  discours public,  techniques rédactionnelles,  outils de communication,  public cible,  langage clair,  approche stratégique,  e-administration,  collaboratif.",96
2220,Sublimer vos interventions publiques : maîtriser l'art de la présentation visuelle,"Communication publique, prise de parole, présentation visuelle,  oratoire,  public speaking,  storytelling,  design visuel,  PowerPoint,  Prezi,  Canva,  Keynote, Google Slides,  Haiku Deck,  SlidesCarnival",96
2222,Comptabilité publique : les fondamentaux ,"Comptabilité publique, finances publiques, contrôle budgétaire, normes comptables, reporting financier, audit public, gestion publique, SAP, Oracle, PeopleSoft,  Sage,  Cegid,  Chorus,  État.",65
2226,Maîtrisez la Gestion Financière Publique : Fondamentaux du Contrôle de Gestion,"Budget public,  dépenses publiques, recettes publiques,  performance publique,  audit public,  gestion financière, contrôle interne,  SAP,  Oracle,  Sage,  Qlik Sense,  Tableau,  Power BI,  COBRA",65
2231,Maîtriser l'Excellence en Gestion de Projets Publics (Niveau 1),"Gestion publique, projet public, management public, excellence opérationnelle,  méthodologie agile,  performance publique,  outils collaboratifs,  PMP, PRINCE2,  Agile, Scrum,  MSP,  Méthode Waterfall,  Microsoft Project,  Jira",66
2233,Maîtriser les projets publics : fondements de la gestion pour le secteur public,"Gestion publique, projets publics, administration publique,  management public,  développement durable,  gouvernance publique,  finances publiques,  méthodologie agile,  gestion de risques,  contrôle de gestion,  outils collaboratifs,  planification stratégique,  budgétisation publique,  outils PMO",66
2239,Maîtriser l'Orchestration de Projets Publics,"Gestion de projet public, planification stratégique,  gouvernance publique,  développement durable,  budgétisation publique,  reporting public,  évaluation de projets,  PMP, PRINCE2,  Agile,  Scrum,  Kanban,  MS Project,  Jira",66
2240,Intelligence Artificielle et Big Data au service du Secteur Public : Maîtriser la Transition Numérique,"Transformation digitale, administration publique,  IA, Big Data,  analyse de données,  cybersécurité,  gestion de projet, outils collaboratifs,  méthodes agiles,  cloud computing,  OpenData,  services numériques,  logiciels métiers secteur public,  Power BI.",200
2245,Intelligence Artificielle pour le Secteur Public : Maîtriser la Création de Contenus Numériques,"IA publique,  administration numérique,  transformation digitale, contenu numérique,  écriture web,  accessibilité web,  réseaux sociaux,  Microsoft Power Automate,  Google Cloud Platform,  Azure,  Amazon Web Services,  Watson Assistant,  DataRobot,  Adobe Experience Manager",200
2392,Maîtriser son temps :  Télétravail performant et sérénité,"Télétravail, productivité, organisation, bien-être, équilibre vie pro/perso, communication, collaboration,  outils collaboratifs,  gestion du temps,  techniques de gestion du stress,  Microsoft Teams, Slack, Zoom, Google Meet, Skype",97
2395,Télétravail performant : Maîtrisez l'organisation en 3h chrono avec les cartes mentales,"Télétravail, productivité, organisation, cartes mentales, méthode, efficacité,  temps,  gestion du temps,  Zoom, Microsoft Teams, Slack, Google Meet, Skype,  Trello",97
2397,Télétravail Haute Performance : Maîtrisez votre Concentration en 3 Heures,"Concentration, productivité, organisation, efficacité, télétravail, management à distance, bien-être au travail,  Zoom, Microsoft Teams, Slack, Google Meet, Skype,  GoToMeeting,  Trello",97
2400,Télétravail Haute Performance : Maîtriser les Réunions Virtuelles en 3 Heures,"Télétravail, productivité, organisation, communication, collaboration, efficacité, bien-être,  outils collaboratifs,  méthodologies agiles, réunions virtuelles, Zoom, Microsoft Teams, Google Meet, Skype",97
2403,Droit du numérique : maîtriser le télétravail collaboratif,"Télétravail, Collaboration, Droit du travail, Productivité, Sécurité numérique,  Gestion de projet,  Outils collaboratifs, Microsoft Teams, Slack, Zoom, Google Workspace,  Trello, Asana, Dropbox",202
2409,Cybersécurité en télétravail : Maîtrisez les outils collaboratifs en 3 heures chrono,"Télétravail, collaboration, cybersécurité, outils collaboratifs,  sécurité informatique,  productivité,  télétravail sécurisé,  Microsoft Teams,  Slack,  Zoom,  Google Meet,  Trello,  Asana,  Dropbox",202
2411,Maîtrisez le travail à distance : cartographiez vos idées et optimisez la collaboration,"Télétravail, Collaboration, Productivité, Outils collaboratifs, Gestion de projet, Communication à distance,  Remote work,  Slack, Microsoft Teams, Google Workspace, Zoom, Asana, Trello, Monday.com",202
2414,Maîtrisez le Travail à Distance : Sketchnoting pour une Collaboration Optimale et une Productivité Accrue,"Télétravail, collaboration, productivité, organisation, communication,  Sketchnoting,  visualisation,  Microsoft Teams, Slack, Zoom, Google Meet, Asana, Trello,  Notion",202
2416,Prospérer à distance : sérénité et impact en 3h chrono,"Télétravail, productivité, bien-être, organisation, équilibre vie pro/perso, concentration,  gestion du temps,  outils collaboratifs,  applications mobiles,  visioconférence,  Zoom, Microsoft Teams, Slack, Google Meet",67
2422,Épanouissement professionnel à distance : sérénité et performance face au changement,"Télétravail, bien-être, productivité, organisation, équilibre vie pro/perso,  gestion du stress,  performance,  Zoom, Microsoft Teams, Slack, Google Meet, Skype,  Trello, Asana",67
2425,Bien-être au télétravail : sérénité et performance face aux défis modernes,"Télétravail, bien-être, productivité, équilibre vie pro-perso, organisation, sérénité, performance,  outils collaboratifs,  gestion du temps,  méthodes agiles,  stress,  conciliation,  Zoom, Microsoft Teams",67
2426,Diriger des équipes virtuelles : Excellence et performance à distance,"Management à distance, leadership virtuel, télétravail, collaboration virtuelle,  productivité à distance, communication à distance,  gestion d'équipe à distance, outils collaboratifs, méthodes de management,  techniques de communication,  plateformes de collaboration,  Microsoft Teams, Slack, Zoom, Google Meet, Asana",33
2429,Diriger à distance : Orchestrer la collaboration et l'intelligence collective,"Management à distance, leadership à distance, télétravail, collaboration virtuelle,  intelligence collective, gestion d'équipe virtuelle,  productivité à distance,  Microsoft Teams,  Zoom, Slack, Google Meet, Asana, Trello, Monday.com",33
2431,Diriger à distance : Maîtriser le management hybride,"Management hybride, télétravail, leadership à distance, communication à distance, collaboration à distance, gestion d'équipe à distance,  productivité à distance,  outils collaboratifs,  méthodologies agiles,  techniques de management,  Microsoft Teams, Slack, Zoom, Google Workspace, Asana, Monday.com",33
2434,"Maîtrisez le Savoir :  Gestion, Capitalisation et Diffusion des Connaissances à Distance","Formation à distance, télétravail, e-learning, gestion de projet à distance, collaboration à distance, partage de connaissances, capitalisation des connaissances, outils collaboratifs, plateforme LMS, Moodle,  Zoom, Microsoft Teams, Google Meet,  SharePoint",130
2438,Maîtriser la vente à distance : négociation et entretien de haut niveau,"Négociation à distance, vente en ligne, télétravail, prospection téléphonique, relation client à distance,  techniques de vente, communication digitale,  Zoom, Skype, Microsoft Teams, Google Meet, Slack,  GoToMeeting, WebEx",224
2442,Transformation Digitale RH :  Piloter le Succès du Télétravail,"Télétravail,  productivité,  collaboration,  management à distance,  bien-être au travail,  outils collaboratifs,  gestion du temps,  Microsoft Teams,  Slack,  Zoom,  Google Meet,  Trello,  Asana,  Monday.com",34
2445,E-commerce Express : Lancez votre boutique en ligne en 3 heures chrono,"E-commerce, boutique en ligne, télétravail, digitalisation,  vente en ligne,  entrepreneuriat,  business plan,  Shopify,  WooCommerce,  PrestaShop,  Etsy,  WordPress,  Magento,  ClickFunnels",34
2448,Intelligence Artificielle : Maîtrisez la Collaboration à Distance et la Création de Contenus,"Collaboration distante, outils collaboratifs, intelligence artificielle, productivité, communication,  gestion de projet,  télétravail,  Microsoft Teams, Slack, Zoom, Google Workspace, Asana, Trello,  Monday.com",202
2451,Épanouissement professionnel à distance : sérénité et optimisme face au changement,"Télétravail, bien-être, productivité, organisation, équilibre vie pro/perso, motivation,  résilience,  Microsoft Teams, Zoom, Slack, Google Meet, Skype,  Trello, Asana",67
2458,Diriger des Projets Agiles à Distance : Maîtrise du Télétravail pour Chefs de Projet,"Télétravail, management à distance,  méthodologie agile, projet agile, chef de projet,  outils collaboratifs,  gestion de projet,  Asana, Trello, Monday.com, Microsoft Teams, Slack, Zoom, Google Meet",225
2461,Maîtrisez la Collaboration Numérique : Padlet en 3 Heures,"Collaboration distante,  télétravail,  productivité numérique,  outils collaboratifs,  gestion de projet à distance,  communication digitale,  formation en ligne,  Padlet,  Miro,  Mural,  Google Workspace,  Microsoft Teams,  Slack,  Zoom",130
2464,Architecte Web : Maîtrise de la Conception et du Management de Projets Digitaux," architecture web, conception web, design web, développement web, gestion de projet, management digital,  projet web,  HTML, CSS, Javascript,  WordPress,  Figma,  Sketch)",68
2469,Digitalisez l'Expérience Client : Conception Web Haut de Gamme,"Expérience utilisateur,  UX design,  UI design,  webdesign,  ergonomie web,  accessibilité web,  optimisation SEO,  HTML, CSS, JavaScript,  React,  Figma,  Sketch,  Adobe XD",68
2471,Maîtrisez WordPress : Création de Sites Web Professionnels,"WordPress, thème, plugin, hébergement, SEO, design web, responsive design,  HTML, CSS, Javascript, PHP, MySQL,  CMS,  bootstrap",68
2474,Créez votre Boutique en Ligne : Maîtrise du Web en 3 Heures,"e-commerce, boutique en ligne, création site web, développement web,  hébergement web,  design web,  marketing digital,  WordPress, Shopify, Wix, Prestashop,  Squarespace,  Webflow,  HTML, CSS",68
2477,Création de sites web performants : attirer vos clients grâce à l'inbound marketing,"SEO, inbound marketing,  UX design, UI design,  web design,  marketing digital,  analyse web,  WordPress,  Shopify, Wix, Webflow, Squarespace,  Google Analytics,  SEMrush",68
2482,Création de Newsletters Professionnelles pour Sites Web,"Création de site,  newsletter, email marketing,  design web,  UX/UI,  contenu web,  SEO,  HTML, CSS, JavaScript, WordPress,  Shopify,  Mailchimp, Sendinblue",68
2485,Dirigez votre Stratégie Digitale : Maîtrise du Webmarketing,"SEO, stratégie digitale,  marketing online,  analyse web,  publicité en ligne,  community management,  inbound marketing, Google Analytics, Google Ads, Facebook Ads, SEMrush,  Ahrefs,  Mailchimp,  Hootsuite",131
2489,Maîtrisez le Web : Fondamentaux techniques du marketing digital,"SEO,  SEM,  Google Analytics,  Google Ads,  marketing digital,  référencement,  publicité en ligne,  WordPress,  Shopify,  HubSpot,  Mailchimp,  Google My Business,  Facebook Ads,  Instagram Ads",131
2493,Maîtrisez la Communication Digitale : Stratégie Social Media Avancée,"Stratégie digitale, community management, social media marketing, publicité en ligne,  influence marketing,  analyse web,  e-réputation,  Facebook, Instagram, Twitter, LinkedIn, TikTok, Pinterest, YouTube.",131
2497,LinkedIn : Booster sa visibilité en 3 heures chrono,"LinkedIn Learning,  réseaux sociaux professionnels,  marketing digital,  acquisition leads,  visibilité online,  stratégie LinkedIn,  optimisation profil LinkedIn,  Twitter,  Facebook,  Instagram,  Xing,  Viadeo,  Indeed,  Salesforce",131
2500,Maîtrisez la Publicité Google : Stratégie SEA et Optimisation Web,"Publicité Google, SEA,  SEO,  Optimisation web,  Google Ads,  Campagnes publicitaires,  Analyse de données,  Mots clés,  Annonces,  Conversions,  Landing pages,  Google Analytics,  Bing Ads,  Facebook Ads",131
2503,Dirigez votre E-commerce : Maîtrise du Webmarketing,"E-commerce, marketing digital, stratégie web, SEO, SEA, analytics, conversion,  Google Analytics, Google Ads, Facebook Ads, Shopify, WooCommerce, Prestashop, Magento",131
2507,Lancez Votre Projet Web : Maîtrise du Webmarketing et Succès Garanti,"SEO, référencement,  marketing digital,  analytique web,  publicité en ligne,  réseaux sociaux,  e-commerce,  Google Analytics,  Google Ads,  SEMrush,  Ahrefs,  Facebook Ads,  Instagram Ads,  WordPress",131
2509,Intelligence Artificielle Web : Maîtrisez ChatGPT en 3 Heures,"ChatGPT, IA conversationnelle, modèles linguistiques, prompt engineering, traitement du langage naturel,  apprentissage automatique,  intelligence artificielle générative,  outils IA,  méthodes IA,  développement web,  API,  programmation,  Python,  JavaScript",69
2512,Naviguer l'Éthique et le Droit de l'IA pour le Web,"Ethique IA, Droit IA,  Web3,  IA responsable,  Algorithmes,  Données personnelles,  RGPD,  Google Cloud AI,  Amazon Web Services, Microsoft Azure, IBM Watson, TensorFlow,  OpenAI,  Deep Learning",69
2516,Maîtrise du Web : Devenez Chef de Projet Digital,"Chef de projet,  webmaster,  gestion de projet,  développement web,  marketing digital,  UX/UI,  e-commerce,  HTML, CSS, JavaScript,  WordPress,  Shopify,  Figma,  Adobe XD",68
2520,Digital Luxe : Sublimer l'expérience utilisateur par la conception web,"UX, UI, design web, accessibilité, ergonomie,  expérience utilisateur,  optimisation,  Figma,  Adobe XD, Sketch, Webflow, WordPress,  Shopify,  Framer",68
2522,Maîtrisez WordPress : Création de Sites Web Professionnels,"WordPress,  sites web,  design web, développement web,  hébergement web,  SEO,  e-commerce,  HTML, CSS, JavaScript, PHP,  MySQL,  bootstrap,  Joomla",68
2525,Création Rapide de Boutiques en Ligne : Lancez Votre E-commerce en 3 Heures,"E-commerce, boutique en ligne, création site web,  Shopify, Prestashop, Wix, WooCommerce,  WordPress,  e-marketing, dropshipping,  SEO,  hébergement web,  design web,  marketing digital",68
2528,Création Web : Stratégie Inbound pour Sites performants,"Inbound marketing, SEO, stratégie digitale,  optimisation web,  analyse web,  UX design,  contenu web, WordPress, Shopify, Wix, Webflow, Squarespace,  Drupal, Joomla",68
2531,Vidéo Web : Stratégie Contenus Haute Définition,"SEO,  marketing digital,  hébergement web,  référencement,  vidéo marketing,  montage vidéo,  contenu web,  WordPress,  Shopify,  Wix,  YouTube,  Vimeo,  Adobe Premiere Pro,  Final Cut Pro",68
2534,Révolutionnez votre narration digitale : création de sites web captivants," narration digitale, création de site web,  site web captivant, expérience utilisateur,  design web,  marketing digital,  SEO,  WordPress,  Wix,  Shopify,  Squarespace,  Webflow,  Figma,  Adobe XD)",68
2537,Maîtrisez l'influence : Stratégie digitale pour créateurs et influenceurs,"Influence marketing, stratégie digitale,  réseaux sociaux,  community management,  contenu viral,  engagement,  audience,  Instagram, TikTok, YouTube, Facebook, Pinterest, Twitter, LinkedIn",131
288,Dynamiser la communication interne ,"Communication interne, communication externe, relations publiques,  influence, engagement,  collaboration, storytelling,  outils de communication, stratégies de communication,  médias sociaux,  email marketing,  intranet,  Microsoft Teams, Slack",100
