ID_FORMATION,TITRE_FORMATION,KEYWORDS,ID_SOUS_DOMAINE
2066,Maîtrisez PowerPoint : Initiation pour le secteur public,"PowerPoint, initiation, numérique, secteur public, administration, présentation, documents,  outils,  méthodologies,  productivité,  efficacité,  formation,  collaboratif,  Google Slides, LibreOffice, Keynote,  Microsoft Teams,  Canva,  Prezi",200
2069,Maîtrisez Word :  Boostez vos Compétences Bureautiques dans le Secteur Public,"Word, Excel, PowerPoint,  Bureautique,  Productivité,  Secteur public,  Administration publique,  numérisation,  logiciels bureautiques,  méthodes de travail,  efficacité,  formation professionnelle,  OpenOffice, Google Workspace",200
2071,Maîtrisez la Bureautique Avancée du Secteur Public : Word Expert,"Word, Excel, PowerPoint, Outlook, Access,  PDF,  Numérisation,  Secteur public,  Administration publique,  Gestion documentaire,  Productivité,  Collaboration,  OpenOffice, LibreOffice",200
2073,Maîtrisez Excel :  Performance Numérique au Service du Secteur Public,"Excel avancé,  productivité,  tableaux croisés dynamiques,  automatisation,  données,  analyse de données,  reporting,  SharePoint, Google Sheets,  OpenOffice Calc,  Power BI,  Power Automate,  Access,  gestion de projet",200
2074,Maîtrisez les Macros VBA Excel : Lancez votre Transition Numérique au Secteur Public,"Excel VBA, Macros, Automatisation, Productivité,  Transition numérique, Secteur public,  Fonction publique,  Access,  Power Automate,  Power Query, Google Apps Script,  Alteryx,  Python,  Tableau",200
2184,Épanouissement professionnel secteur public : Maîtriser durablement le stress,"Gestion du stress, bien-être au travail, équilibre vie pro-perso, développement personnel,  résilience, mindfulness, coaching, outils anti-stress, techniques de relaxation,  Mindfulness, sophrologie,  yoga, cohérence cardiaque,  gestion du temps.",220
2185,Libérez Votre Potentiel :  Épanouissement Personnel au Service du Secteur Public,"Leadership,  Motivation,  Efficacité,  Bien-être,  Communication,  Gestion du stress,  Développement professionnel,  Fonction publique,  Service public,  Employés publics,  Performance,  Résilience,  Coaching,  Mentoring",220
2188, rayonner au travail :  maîtriser l'art de la communication assertive  dans le secteur public,"Communication assertive,  leadership,  gestion du stress,  prise de parole,  négociation,  influence,  assertivité,  secteur public, fonction publique,  service public,  relation interpersonnelle,  techniques de communication,  Microsoft Teams,  Slack",220
2197,Service Public : Sérénité et Excellence Relationnelle en Situation Délicate,"Service client, communication, relationnel, gestion du stress, empathie, résolution de conflits, médiation, administration publique, fonction publique territoriale, agents publics, accueil physique, accueil téléphonique,  téléphonie, logiciel CRM.",129
2221,Le cadre budgétaire et comptable des collectivités territoriales ,"Budget, comptabilité publique, finances locales, contrôle budgétaire, cadre réglementaire, collectivités territoriales, gestion publique, SAP, Oracle,  Sage,  Cegid,  Chorus Pro,  EBP,  Agir.",65
2223,Maîtrisez la Comptabilité Publique : Initiation à la Gestion Financière,"Comptabilité publique, gestion financière publique, finances publiques, contrôle budgétaire, normes comptables publiques,  audit public, reporting financier public, SAP, Oracle, Sage,  Chorus Pro,  Coda,  Budgeting,  Mieux gérer",65
2225,Maîtrisez la Performance Sociale des Finances Publiques,"Performance sociale, finances publiques, contrôle budgétaire, analyse financière, reporting social, gestion publique,  indicateurs sociaux,  outils de gestion,  méthodologies de contrôle,  comptabilité publique, SAP,  Oracle,  Sage,  Qlik Sense",65
2227,Dashboarding Financier Public : Concevoir une Supervision Performante,"Tableau de bord, supervision, performance, finance publique, contrôle budgétaire, analyse financière, reporting, Power BI, Tableau, Qlik Sense, Excel, Google Data Studio, SAP BusinessObjects, Oracle BI",65
2230,Finance publique : Décryptage budgétaire pour décideurs,"Budget public, finances publiques, contrôle budgétaire, analyse financière, reporting financier, gestion publique, décisions financières,  SAP, Oracle, Sage,  Qlik Sense,  Tableau,  Power BI,  Excel",65
2235,Maîtrisez l'Art du Management de Projet dans le Secteur Public,"Gestion de projet public, management public,  performance publique,  gouvernance publique,  développement durable,  budget public,  planification stratégique,  PMBOK,  Agile,  Prince2,  MSP,  Scrum,  MS Project,  Jira",66
2238,Maîtrisez l'Agilité Publique : 3 outils en 3 heures chrono,"Méthode Agile, Scrum, Kanban,  Gestion de projet,  Transformation digitale,  Performance publique,  Innovation publique,  Management public,  outils collaboratifs,  gestion de temps,  priorisation,  risques projets,  Jira,  Azure DevOps",66
2241,Intelligence Artificielle et ChatGPT : Maîtrisez la Transition Numérique du Secteur Public (en 3h),"Transformation digitale, administration publique,  IA,  ChatGPT,  productivité,  outils numériques,  cybersécurité,  OpenAI, Google Workspace, Microsoft 365,  Azure,  AWS,  Data,  automatisation",200
2242,Révolutionnez vos écrits professionnels : Intelligence Artificielle au service du secteur public,"Intelligence artificielle,  écriture professionnelle,  secteur public,  numérisation,  productivité,  automatisation,  efficacité,  transformation digitale,  Microsoft Word,  Google Docs,  Grammarly,  QuillBot,  Jasper,  Copy.ai",200
2406,Maîtrisez Microsoft Teams en 3h : Collaboration et Télétravail Optimisés,"Télétravail, collaboration, productivité, efficacité, communication, outils collaboratifs,  gestion de projet, Microsoft Teams, Slack, Zoom, Google Meet, Skype Entreprise,  Asana, Trello",202
2408,Maîtrisez la Collaboration à Distance : Organisez et Partagez vos Notes OneNote en 3h,"Collaboration distante, organisation, partage, notes, OneNote, productivité, efficacité, outils collaboratifs,  Teams, Slack, Zoom, Google Workspace, Dropbox,  Trello",202
2410,Libérez le Potentiel Collaboratif :  Maîtrise des Outils pour le Travail à Distance,"Télétravail, collaboration, productivité, efficacité, communication, outils digitaux, gestion de projet,  Microsoft Teams, Slack, Zoom, Google Workspace, Asana, Trello, Skype",202
2412,Réunions Créatives à Distance : Maîtrisez la Collaboration Virtuelle,"Collaboration virtuelle, réunions en ligne, travail collaboratif, productivité distante, communication à distance, outils collaboratifs, management à distance,  Microsoft Teams, Zoom, Google Meet, Slack,  Trello, Asana, Discord",202
2413,Télétravail : Maîtrisez la Collaboration et Optimisez Votre Apprentissage,"Télétravail, collaboration, productivité, efficacité, outils collaboratifs, communication, organisation,  Microsoft Teams, Slack, Zoom, Google Workspace, Asana, Trello, Skype",202
2415,Épanouissement professionnel à distance : Maîtriser la collaboration et préserver son équilibre,"Télétravail, collaboration, productivité, équilibre vie pro/perso, bien-être au travail,  outils collaboratifs,  gestion du temps,  Microsoft Teams, Slack, Zoom, Google Workspace,  Asana, Trello,  Notion",202
359,Réaliser la clôture comptable et mettre en œuvre une démarche de révision ,"Clôture comptable, révision comptable, bilan comptable, compte de résultat, normes comptables,  audit interne, déclarations fiscales,  Sage, QuickBooks, Xero, Cegid, EBP, Excel,  SAP",205
360,"Préparer, établir et clôturer les comptes annuels ","Comptabilité générale, bilan, compte de résultat, liasse fiscale, normes comptables, audit interne, déclarations fiscales, Sage, Cegid, QuickBooks, Xero, EBP, Excel,  ",205
362,L'essentiel de la comptabilité bancaire ,"Comptabilité bancaire, tenue de comptes,  analyse financière,  gestion budgétaire,  réglementation bancaire,  déclaration fiscale,  audit interne,  Sage,  Xero,  QuickBooks,  Cegid,  EBP,  SAP,  Oracle",205
363,Maîtriser la comptabilité fournisseurs ,"Comptabilité fournisseurs, factures, paiement, TVA, rapprochement bancaire, écritures comptables, reporting, logiciel comptable, Sage, QuickBooks, Xero, Cegid, EBP, SAP",205
365,Maîtriser la TVA dans la comptabilité fournisseurs ,"Comptabilité fournisseurs, TVA, déclarations fiscales, impôts, facturation, gestion des paiements,  réglementation fiscale,  Sage, QuickBooks, Xero, Cegid, EBP,  SAP.",205
366,Pratique de la comptabilité des immobilisations corporelles et incorporelles ,"Comptabilité immobilière, amortissement, fiscalité des immobilisations, normes comptables,  bilan,  inventaire, reporting,  Sage, Cegid, QuickBooks, Xero, SAP, EBP,  Excel",205
368,Maîtriser la comptabilité des charges de personnel ,"Comptabilité analytique, gestion de paie, charges sociales, déclarations fiscales,  bilan, résultat, trésorerie,  Sage, Cegid, QuickBooks,  Xero,  EBP,  AAT",205
370,Journée Nationale de la Paie - 25e édition ,"Paie,  salaire,  impôt,  charges sociales,  déclaration,  réglementation,  audit,  logiciel paie,  gestion,  formation,  comptabilité,  fiscalité,  droit du travail,  Sage",205
371,Pratique de la consolidation des comptes - Niv. 1 ,"Comptabilité générale, normes IFRS, consolidation, reporting financier, analyse financière, bilan, compte de résultat,  Sage, Cegid, QuickBooks, SAP, Xero, EBP",205
373,Pratique de la consolidation des comptes - Niv. 2 ,"Comptabilité générale, normes IFRS, consolidation, reporting financier, analyse financière, audit interne, fiscalité des entreprises,  SAP, Sage, Xero, QuickBooks, Oracle Financials, EBP, Cegid",205
1,Responsable Achats ,"Négociation,  Supply chain,  Logistique,  Sourcing,  Performance achats,  Gestion des risques,  Analyse des coûts,  SAP Ariba, Coupa, Oracle Procurement Cloud,  Jaggaer,  Zycus,  Ivalua,  SciQuest",206
2,Management opérationnel des achats ," Négociation, Approvisionnement, Logistique, Gestion des stocks, Performance achats,  Analyse des coûts,  Gestion de projet,  SAP Ariba, Coupa, Oracle Procurement Cloud, Zycus, Jaggaer, Ivalua,  Basware)",206
4,Formation pratique à l'achat ,"négociation, stratégie, supply chain, sourcing, achats responsables, performance, achats publics, SAP Ariba, Coupa, Oracle Procurement Cloud, Jaggaer, Zycus, Ivalua,  Simul",206
5,Formation assistant achat ,"Assistant achat,  gestion des achats,  négociation fournisseurs,  approvisionnement,  logistique achats,  gestion de stock,  analyse des coûts,  SAP, Oracle, Coupa,  Ariba,  Zycus,  Spend Management,  e-procurement",206
6,Achat Public ,"Négociation,  Achats responsables,  Supply chain,  Marchés publics,  Gestion des fournisseurs,  Analyse des coûts,  Performance achats,  SAP Ariba,  Coupa,  Oracle Procurement Cloud,  Jaggaer,  Ivalua,  Scienta,  e-Procurement",206
8,Achat et approvisionnement en PME ,"Négociation,  approvisionnement,  gestion des stocks,  analyse des coûts,  supply chain,  logistique,  performance achats,  SAP, Oracle, Coupa,  Ariba,  e-procurement,  Excel,  Power BI",206
9,Négociation d'achats - Niveau 1 ,"Négociation commerciale, techniques de négociation, stratégie d'achat,  gestion des achats,  techniques de vente,  optimisation des coûts,  analyse des besoins,  SAP Ariba, Coupa, Oracle Procurement Cloud, Jaggaer, Zycus, Ivalua,  Negotium",98
10,Négociation d'achats - Niveau 2 ,"Négociation commerciale, techniques de négociation, stratégies d'achat, gestion des fournisseurs,  analyse des coûts,  optimisation des achats,  achats responsables,  SAP Ariba, Coupa, Jaggaer, Oracle Procurement Cloud,  Zycus,  Ivalua,  Proactis",98
44,Assistant(e) d'équipe : être acteur de la performance de l'équipe ,"Assistant manager,  gestion de projet,  efficacité collective,  communication interne,  organisation du travail,  prise d'initiative,  gestion du temps,  Microsoft Outlook,  Google Workspace,  Slack,  Asana,  Trello,  Monday.com,  Notion",5
47,Assistant(e) formation ,"Assistant administratif, gestion administrative, secrétariat, organisation, agenda, communication, relation client,  formation professionnelle,  apprentissage,  emploi,  recrutement,  Ressources Humaines,  Mooc,  Plateformes de formation.",5
48,Gestionnaire paie et administration du personnel ,"Gestion du personnel, paie, administration, ressources humaines, recrutement, contrat de travail, logiciel paie,  Sage, ADP, Cegid, Talentsoft, Workday, SAP SuccessFactors,  Excel",5
2417,"Prospérer à distance :  Objectifs clairs, équilibre retrouvé (Atelier 3h)","Télétravail, productivité, bien-être, organisation, concentration, équilibre vie pro-perso,  gestion du temps,  Zoom, Microsoft Teams, Slack, Google Meet, Skype,  Trello, Asana",67
2418,Bien-être au Travail à Distance : Cultiver sa Résilience face aux Changements,"Télétravail,  productivité,  bien-être,  organisation,  résilience,  stress,  équilibre vie pro/perso,  Zoom, Microsoft Teams, Slack, Google Meet,  Trello,  Asana,  Monday.com",67
2420,Le bien-être au télétravail : surmonter les biais cachés d'un monde changeant,"Télétravail, bien-être, équilibre, productivité, organisation,  stress,  communication,  outils collaboratifs,  gestion du temps,  méthodes agiles,  Microsoft Teams, Zoom, Slack, Google Meet",67
2423,Épanouissement professionnel à distance : sérénité et performance en toute fluidité,"Télétravail, productivité, bien-être, organisation, équilibre vie pro-perso,  stress,  épanouissement,  Zoom, Microsoft Teams, Slack, Google Meet, Skype,  Trello, Asana",67
2432,Maîtrisez la Collaboration Projet à Distance avec Microsoft 365 et Teams,"Collaboration, projet, distance, gestion, équipe, efficacité, productivité, Microsoft Teams,  Zoom, Slack, Google Workspace, Asana, Trello, Monday.com",225
2433,Maîtrisez l'animation de classes virtuelles :  Formation intensive en télétravail (3h),"Télétravail,  e-learning,  formation en ligne,  animation pédagogique,  classe virtuelle,  outils collaboratifs,  productivité à distance,  Zoom,  Microsoft Teams,  GoToMeeting,  WebEx,  Google Meet,  Skype Entreprise,  Adobe Connect",130
2440,Maîtrisez la vente et la négociation téléphonique à distance,"Vente téléphonique, négociation commerciale, télétravail, prospection téléphonique, relation client à distance, techniques de vente, argumentaire commercial,  Zoom, Skype, Microsoft Teams, Google Meet, Slack,  GoToMeeting,  WebEx",224
2441,Transformation Digitale :  Piloter le Succès du Télétravail en Entreprise,"Télétravail, productivité, collaboration, communication, management, organisation, bien-être, outils collaboratifs, méthodes agiles, transformation digitale,  Microsoft Teams, Slack, Zoom, Google Workspace,  Trello, Asana",34
2444,Diriger le virage numérique :  Intégration réussie du télétravail pour les DSI,"Télétravail,  management à distance,  productivité,  collaboration,  sécurité informatique,  outils collaboratifs,  transition digitale,  Microsoft Teams,  Zoom,  Slack,  Google Workspace,  GoToMeeting,  Cisco Webex,  O365",34
2463,Architecte Web : Maîtriser la Transformation Numérique des Sites,"Responsive Design, UX/UI, SEO, Développement web, Hébergement web,  Accessibilité web,  E-commerce,  Méthodologie Agile,  Design Thinking,  Transformation digitale,  Architecture web,  Web semantique,  CMS WordPress,  Shopify",68
2465,Diriger avec aisance la création de votre site web,"WordPress,  HTML, CSS,  JavaScript,  Responsive Design,  UX/UI, SEO,  Hébergement web,  Nom de domaine,  Création de contenu,  Graphisme web,  Plateforme CMS,  Figma, Adobe XD",68
2466,Création d'Expériences Web Inoubliables : Design UX/CX,"UX, UI, design web, ergonomie, expérience utilisateur, accessibilité, SEO,  Figma, Adobe XD, Sketch, Webflow, WordPress,  Shopify,  Framer",68
2468,Création de sites web : maîtriser l'expérience utilisateur et l'ergonomie,"UX, ergonomie, design web, développement web,  webdesign, accessibilité, SEO,  expérience utilisateur, wireframing, maquettage, prototyping,  HTML, CSS, JavaScript",68
2470,Design Web Intuitif : Maîtriser le Design Thinking pour des Sites Exceptionnels,"Design UX, ergonomie web, accessibilité web, expérience utilisateur, wireframing, prototyping,  maquettage,  Design Thinking,  Figma, Sketch, Adobe XD, InVision, Webflow, WordPress",68
2472,WordPress Avancé : Maîtrisez la Création de Sites Web Professionnels,"WordPress, thèmes, plugins, SEO, hébergement,  responsive design, sécurité,  HTML, CSS, JavaScript, PHP, MySQL,  Symfony,  React",68
2473,Création Web : Maîtriser l'Art de la Conception Graphique,"Design web, UX design, UI design, développement web, ergonomie web,  SEO,  webdesign responsif,  Figma, Adobe XD, Sketch, Photoshop, Illustrator, WordPress,  HTML/CSS",68
2475,Lancez Votre Projet Web : Maîtrise de la Création et du Succès en Ligne," création site web, développement web, design web, hébergement web, référencement web, marketing digital, stratégie web,  WordPress, Wix, Shopify, Squarespace, Webflow,  Bootstrap,  HTML)",68
2476,Maîtrisez le code : Création de sites web avec HTML5,"HTML, CSS, JavaScript,  Bootstrap,  WordPress,  Responsive Design, SEO,  hébergement web,  design web,  développement web,  programmation web,  langages web,  frameworks web,  CMS",68
2479,Maîtrisez l'Art visuel Web et Réseaux Sociaux," design web, développement web, UX/UI, ergonomie web, webdesign, responsive design, SEO,  outils web,  réseaux sociaux,  graphisme web,  marketing digital,  HTML, CSS, Javascript, WordPress)",68
2480,Vidéo Web :  Intégration Vidéo pour une Stratégie Digitale Optimale,"Intégration vidéo, stratégie digitale, vidéo marketing,  optimisation vidéo,  hébergement vidéo,  SEO vidéo,  analyse vidéo,  HTML5, CSS3, JavaScript,  WordPress,  YouTube, Vimeo,  Wistia",68
2481,Emailing performant : Maîtrisez la conception web et boostez vos résultats,"Email marketing,  marketing digital,  campagne emailing,  analyse web,  optimisation taux ouverture,  automatisation marketing,  conception responsive,  WordPress,  Shopify,  Mailchimp,  Sendinblue,  ActiveCampaign,  GetResponse,  HubSpot",68
2483,Création Web Rapide : Infographie Pro en 3 Heures,"Conception web, création site internet, développement web, infographie, graphisme web, design web, webdesign,  WordPress,  Figma, Adobe Photoshop, Adobe Illustrator, Sketch, Wix, Shopify",68
2486,Maîtrisez le Web : Stratégies digitales performantes,"SEO,  SEM,  référencement,  marketing digital,  analyse web,  community management,  publicité en ligne, Google Analytics, Google Ads,  Facebook Ads,  Twitter Ads,  LinkedIn Ads,  Instagram Ads,  Bing Ads",131
2487,Attirer et fidéliser vos clients en ligne : Maîtrise du webmarketing," marketing digital, acquisition clients, fidélisation clients, stratégie web, référencement,  analyse web,  publicité en ligne, Google Ads, Facebook Ads, SEO,  SEM,  email marketing,  community management,  réseaux sociaux)",131
2488,Le Web : Maîtriser l'univers du marketing digital,"SEO, SEM,  référencement,  marketing digital,  analyse web,  publicité en ligne,  community management, Google Analytics, Google Ads,  Bing Ads,  Facebook Ads,  Instagram Ads,  LinkedIn Ads,  Twitter Ads",131
2490,Intelligence Artificielle et Big Data : Maîtrisez le Webmarketing de Demain," Webmarketing, Intelligence artificielle, Big data,  Analyse prédictive,  Marketing digital,  SEO,  SEM,  Google Analytics,  Data Studio,  ChatGPT,  IA générative,  Machine learning,  Deep learning,  Cloud computing)",131
2491,Maîtrisez le Web :  Stratégies Digitales et Réseaux Sociaux,"SEO,  SEM,  référencement naturel,  réseaux sociaux,  e-réputation,  marketing digital,  analyse web, Google Analytics,  Facebook Ads,  Instagram Marketing,  LinkedIn Ads,  Twitter Ads,  Google My Business,  outils webmarketing",131
2494,Maîtrisez l'Influence Web : Stratégie Digitale pour une Marque Forte,"influence digitale, stratégie web, marketing digital, communication digitale, branding, réputation en ligne,  visibilité web,  SEO,  SEM,  community management, réseaux sociaux,  Google Analytics,  Facebook Ads, Instagram Marketing",131
2495,Maîtrisez la communauté en ligne : stratégies webmarketing performantes,"Community management, stratégie digitale, réseaux sociaux, engagement, influence, analytics, contenu,  Facebook, Instagram, Twitter, LinkedIn, TikTok, Pinterest, YouTube",131
2496,"Maîtrisez la publicité digitale : stratégies web, réseaux sociaux et retargeting","Publicité digitale, Stratégies web, Réseaux sociaux, Retargeting,  Marketing digital,  SEO, SEA, Google Ads, Facebook Ads, Instagram Ads, LinkedIn Ads, Twitter Ads,  Analytics,  Gestion de campagnes",131
2498,Maîtrisez le référencement SEM : Stratégie webmarketing performante,"SEM, SEO, Google Ads, Bing Ads, publicité en ligne,  marketing digital,  analyse de mots clés, stratégie digitale,  Google Search Console, Google Analytics,  Bing Webmaster Tools,  SEMrush,  Ahrefs,  Moz",131
2499,Maîtrisez la visibilité web :  SEO et stratégies marketing digitales,"SEO, référencement,  marketing digital, stratégie web,  visibilité online,  analyse web,  optimisation site web, Google Search Console, Google Analytics, SEMrush,  Ahrefs,  Majestic,  Bing Webmaster Tools,  Google Ads",131
2501,"Analysez, Optimisez, Réussite : Maîtrisez Google Analytics pour un Webmarketing performant","Google Tag Manager,  SEO,  Conversion Rate Optimization  CRO),  A/B testing,  Data Studio,  e-commerce,  reporting,  Google Search Console,  SEMrush,  HubSpot,  Google Ads,  Matomo,  Clicky,  Adobe Analytics",131
2502,Maîtrisez Google Tag Manager :  Optimisation Web et Performances Marketing,"Google Analytics,  Conversion,  Attribution,  Efficacité marketing,  Suivi,  Marketing digital,  Analyse de données,  Google Ads,  Bing Ads,  Adobe Analytics,  Matomo,  Clicky,  Segment,  Data Studio",131
2504,Commerce en ligne : Maîtrisez les leviers du webmarketing,"SEO, e-commerce, marketing digital, publicité en ligne, analytics web, réseaux sociaux,  email marketing, Google Analytics, Google Ads, Facebook Ads,  Instagram Marketing,  Shopify, WooCommerce,  Prestashop",131
2505,Le Commerce Digital : Maîtrisez la Vente en Ligne,"E-commerce, vente en ligne, marketing digital, stratégie digitale, acquisition client,  publicité en ligne,  analyse web,  SEO, SEA, Google Ads, Facebook Ads, Instagram Ads,  Shopify, WooCommerce",131
2506,Lancez votre boutique en ligne : maîtrisez le webmarketing en 3h,"e-commerce, boutique en ligne, marketing digital,  vente en ligne,  publicité en ligne, stratégie digitale,  SEO,  Shopify, WooCommerce, Prestashop,  Magento,  Google Ads, Facebook Ads,  Instagram Shopping",131
2510,Révolutionnez vos écrits professionnels avec l'IA,"Révolution, écriture professionnelle, IA générative, optimisation SEO, contenu web, rédaction web, productivité,  outils IA,  ChatGPT,  Jasper, Copy.ai,  Bard,  Rytr,  Grammarly",69
2511,Ingénierie Web IA : Maîtrise des Projets d'Intelligence Artificielle,"Machine Learning, Deep Learning,  Big Data,  IA conversationnelle,  Algorithmes,  Data Science,  Python,  Ingénierie logicielle,  Développement web,  Cloud computing, TensorFlow,  PyTorch,  Keras,  Scikit-learn",69
2514,Création de Contenus Révolutionnaires avec l'IA,"IA générative,  contenu marketing,  rédaction web,  optimisation SEO,  stratégie digitale,  automatisation,  productivité  ... ChatGPT,  Jasper,  Copy.ai,  Bard,  Rytr,  Article Forge,  HubSpot",69
2515,Architecte Web : Maîtriser la Transformation Digitale," architecture web, design web, développement web, UX/UI, responsive design, SEO,  webmarketing,  HTML, CSS, JavaScript,  React, Angular, Node.js, WordPress)",68
2518,Architectes du Web :  Maîtriser l'Expérience Client Exceptionnelle,"UX, UI, ergonomie, accessibilité, SEO, design web, CMS, WordPress, Figma, Adobe XD, Sketch, Webflow,  HTML, CSS",68
2519,Création de sites web : Maîtrisez l'expérience utilisateur et l'ergonomie web,"UX, ergonomie web, design web, développement web, accessibilité web, référencement, SEO,  HTML, CSS, JavaScript, WordPress, Figma, Adobe XD, Sketch",68
2521,Design Web Innovant : Maîtriser le Design Thinking,"Design UX,  ergonomie web,  expérience utilisateur,  réactivité web,  SEO,  webdesign responsive,  conception UI,  Figma,  Sketch,  Adobe XD,  InVision,  WordPress,  Webflow,  Framer",68
2523,Maîtrisez WordPress : Conception Web Professionnelle - Niveau Avancé,"WordPress,  CMS,  HTML, CSS,  PHP,  JavaScript,  Responsive design,  SEO,  UX,  UI,  Hébergement,  Webdesign,  Développement web,  Création site internet",68
2524,Création Web : Maîtriser l'Art de la Conception Visuelle,"Design web, UX design, UI design, développement web, ergonomie web,  SEO,  marketing digital,  Photoshop, Illustrator, Figma, Sketch, Adobe XD, WordPress, Webflow",68
2526,Lancez votre activité web : Maîtrise de la création de sites performants,"WordPress,  SEO,  hébergement,  design web,  UX,  UI,  e-commerce,  HTML, CSS, JavaScript,  PHP,  Symfony,  React,  Bootstrap",68
2527,Créez des sites web époustouflants : maîtrisez le HTML5,"HTML, CSS, JavaScript,  WordPress,  Responsive Design,  SEO,  UX/UI,  web design, développement web,  création site internet,  hébergement web,  framework web,  Figma,  Sketch",68
2529,Création de sites web captivants : maîtriser l'art de l'écriture web," écriture web, SEO, UX, design web, référencement, contenu web,  marketing digital,  WordPress,  Shopify, Wix, Webflow, Squarespace,  Figma, Adobe XD)",68
